{
  "$schema": "./schemas/providers.schema.json",
  "schema_version": 3,
  "hard_budget_usd": 0,
  "allow_overage": false,
  "allow_credit_purchase": false,
  "allow_metered_provider": false,
  "allow_unknown_provider": false,
  "quota_evidence_ttl_minutes": 60,
  "providers": {
    "local_deterministic": {
      "provider_id": "local",
      "capability_id": "deterministic_ci",
      "provider_mode": "local",
      "plane": "ci",
      "enabled": true,
      "classification": "FREE_VERIFIED",
      "billing_model": "none",
      "repository_visibility_scope": "ANY",
      "execution_class": "LOCAL",
      "zero_cost_requirements": [
        "No external billing provider is invoked"
      ],
      "requires_ai_api": false,
      "mandatory_ci_allowed": true,
      "automatic_execution_allowed": true,
      "official_source_url": "https://docs.python.org/3/library/unittest.html",
      "plan_scope": "Локальный Python runtime владельца",
      "required_credentials": [],
      "required_permissions": [
        "read repository workspace"
      ],
      "hard_limit_mechanism": "Нет внешнего billing provider; запускается только локальный детерминированный код.",
      "verified_at": "2026-08-13T00:00:00Z",
      "valid_until": "2030-01-01T00:00:00Z",
      "outbound_domains": [],
      "data_handling": "Данные не покидают локальную машину.",
      "deterministic_fallback": "Остановить проверку и показать локальную ошибку.",
      "internal_limits": {}
    },
    "github_self_hosted": {
      "provider_id": "github",
      "capability_id": "actions_self_hosted",
      "provider_mode": "github",
      "plane": "ci",
      "enabled": true,
      "classification": "OWNER_PROVIDED",
      "billing_model": "owner_provided",
      "repository_visibility_scope": "ANY",
      "execution_class": "SELF_HOSTED",
      "zero_cost_requirements": [
        "Fresh owner-resource attestation",
        "No metered cloud provisioning"
      ],
      "requires_ai_api": false,
      "mandatory_ci_allowed": true,
      "automatic_execution_allowed": true,
      "official_source_url": "https://docs.github.com/en/actions/concepts/runners/self-hosted-runners",
      "plan_scope": "GitHub Actions на отдельном self-hosted runner владельца",
      "required_credentials": [
        "GitHub runner registration token"
      ],
      "required_permissions": [
        "dedicated ephemeral untrusted runner",
        "separate trusted runner"
      ],
      "hard_limit_mechanism": "GitHub-hosted minutes не расходуются; автоматическое cloud provisioning запрещено.",
      "verified_at": "2026-08-13T00:00:00Z",
      "valid_until": "2026-09-13T00:00:00Z",
      "outbound_domains": [
        "github.com",
        "api.github.com",
        "objects.githubusercontent.com"
      ],
      "data_handling": "PR-код выполняется только в одноразовом изолированном runner без secrets и доступа к production.",
      "deterministic_fallback": "Локальные проверки; trusted mutation остаётся BLOCKED.",
      "internal_limits": {
        "max_parallel_jobs": 2
      }
    },
    "gitlab_self_hosted": {
      "provider_id": "gitlab",
      "capability_id": "ci_self_hosted",
      "provider_mode": "gitlab",
      "plane": "ci",
      "enabled": false,
      "classification": "OWNER_PROVIDED",
      "billing_model": "owner_provided",
      "repository_visibility_scope": "ANY",
      "execution_class": "SELF_HOSTED",
      "zero_cost_requirements": [
        "Fresh owner-resource attestation",
        "No metered cloud provisioning"
      ],
      "requires_ai_api": false,
      "mandatory_ci_allowed": true,
      "automatic_execution_allowed": true,
      "official_source_url": "https://docs.gitlab.com/ci/runners/",
      "plan_scope": "GitLab CI на отдельном self-managed runner владельца",
      "required_credentials": [
        "GitLab runner authentication token",
        "protected masked ADWF_GITLAB_TOKEN with read_api"
      ],
      "required_permissions": [
        "dedicated ephemeral untrusted runner",
        "separate protected trusted runner"
      ],
      "hard_limit_mechanism": "Shared compute minutes не используются; автоматическое cloud provisioning запрещено.",
      "verified_at": "2026-08-13T00:00:00Z",
      "valid_until": "2026-09-13T00:00:00Z",
      "outbound_domains": [
        "gitlab.com"
      ],
      "data_handling": "MR-код выполняется только в одноразовом изолированном runner без protected variables.",
      "deterministic_fallback": "Локальные проверки; trusted mutation остаётся BLOCKED.",
      "internal_limits": {
        "max_parallel_jobs": 2
      }
    },
    "github_public_standard": {
      "provider_id": "github",
      "capability_id": "actions_public_standard",
      "provider_mode": "github",
      "plane": "ci",
      "enabled": true,
      "classification": "FREE_VERIFIED",
      "billing_model": "none",
      "repository_visibility_scope": "PUBLIC_ONLY",
      "execution_class": "STANDARD_HOSTED",
      "zero_cost_requirements": [
        "Repository visibility is PUBLIC",
        "Runner is a standard GitHub-hosted runner"
      ],
      "requires_ai_api": false,
      "mandatory_ci_allowed": true,
      "automatic_execution_allowed": true,
      "official_source_url": "https://docs.github.com/en/actions/reference/runners/github-hosted-runners",
      "plan_scope": "Только public repository и standard GitHub-hosted runner",
      "required_credentials": [
        "GITHUB_TOKEN"
      ],
      "required_permissions": [
        "contents: read"
      ],
      "hard_limit_mechanism": "Standard GitHub-hosted runners для public repositories бесплатны; larger runners запрещены.",
      "verified_at": "2026-08-13T00:00:00Z",
      "valid_until": "2026-09-13T00:00:00Z",
      "outbound_domains": [
        "github.com",
        "api.github.com",
        "objects.githubusercontent.com"
      ],
      "data_handling": "Исходный код публичен; включение требует отдельного решения владельца о раскрытии.",
      "deterministic_fallback": "Локальные детерминированные проверки; trusted mutation остаётся BLOCKED до GitHub readback.",
      "internal_limits": {
        "larger_runners_allowed": false
      }
    },
    "github_private_free_quota": {
      "provider_id": "github",
      "capability_id": "actions_private_standard",
      "provider_mode": "github",
      "plane": "ci",
      "enabled": false,
      "classification": "INCLUDED_QUOTA",
      "billing_model": "free_quota",
      "repository_visibility_scope": "PRIVATE_ONLY",
      "execution_class": "STANDARD_HOSTED",
      "zero_cost_requirements": [
        "Repository visibility is PRIVATE",
        "Fresh account quota and storage evidence",
        "Overage is disabled"
      ],
      "requires_ai_api": false,
      "mandatory_ci_allowed": true,
      "automatic_execution_allowed": true,
      "official_source_url": "https://docs.github.com/en/actions/reference/limits",
      "plan_scope": "GitHub Free private repositories, общий лимит аккаунта/организации",
      "required_credentials": [
        "GITHUB_TOKEN"
      ],
      "required_permissions": [
        "contents: read",
        "billing budget stop usage"
      ],
      "hard_limit_mechanism": "Budget stop usage и allow_overage=false; без подтверждения hosted job блокируется.",
      "verified_at": "2026-08-13T00:00:00Z",
      "valid_until": "2026-09-13T00:00:00Z",
      "outbound_domains": [
        "github.com",
        "api.github.com",
        "objects.githubusercontent.com"
      ],
      "data_handling": "Private repository; PR job не получает secrets.",
      "deterministic_fallback": "Self-hosted или локальные проверки.",
      "internal_limits": {
        "platform_minutes": 2000,
        "normal_minutes": 1400,
        "hard_minutes": 1600,
        "recovery_reserve_minutes": 400,
        "artifact_warning_mb": 250,
        "artifact_stop_mb": 350,
        "cache_stop_mb": 2048,
        "max_parallel_jobs": 3,
        "packages_enabled": false,
        "larger_runners_allowed": false
      }
    },
    "gitlab_shared_free_quota": {
      "provider_id": "gitlab",
      "capability_id": "shared_compute_free",
      "provider_mode": "gitlab",
      "plane": "ci",
      "enabled": false,
      "classification": "INCLUDED_QUOTA",
      "billing_model": "free_quota",
      "repository_visibility_scope": "ANY",
      "execution_class": "STANDARD_HOSTED",
      "zero_cost_requirements": [
        "Fresh namespace compute quota evidence",
        "Purchased compute is disabled"
      ],
      "requires_ai_api": false,
      "mandatory_ci_allowed": true,
      "automatic_execution_allowed": true,
      "official_source_url": "https://docs.gitlab.com/ci/pipelines/compute_minutes/",
      "plan_scope": "GitLab Free shared runners",
      "required_credentials": [
        "CI_JOB_TOKEN"
      ],
      "required_permissions": [
        "protected variables excluded from MR jobs"
      ],
      "hard_limit_mechanism": "Internal hard limit ниже platform quota; overage и purchased compute запрещены.",
      "verified_at": "2026-08-13T00:00:00Z",
      "valid_until": "2026-09-13T00:00:00Z",
      "outbound_domains": [
        "gitlab.com"
      ],
      "data_handling": "MR job не получает protected variables.",
      "deterministic_fallback": "Self-managed или локальные проверки.",
      "internal_limits": {
        "platform_minutes": 400,
        "normal_minutes": 280,
        "hard_minutes": 320,
        "recovery_reserve_minutes": 80,
        "max_parallel_jobs": 2
      }
    },
    "chatgpt_codex_subscription": {
      "provider_id": "openai",
      "capability_id": "interactive_writer_reviewer",
      "provider_mode": "openai",
      "plane": "ai",
      "enabled": false,
      "classification": "CONDITIONAL_FREE",
      "billing_model": "included_subscription",
      "repository_visibility_scope": "NOT_APPLICABLE",
      "execution_class": "INTERACTIVE",
      "zero_cost_requirements": [